User_ID,Description,Browser_Used,Device_Used,Positive
id10700,"Stayed for - night as part of large meeting. Many problems, not the least of which was everyones room eys stopped working at noon each day. Rooms are large, but furnishings old. Curtain hooks were missing, baseboard heater covers were falling off, taps in bathroom dripped incessantly. Great fitness center, however. I would suggest staying elsewhere until someone reinvests in bringing this hotel up to the standards expected of a Sheraton.",Firefox,Desktop,0
id10701,"Wonderful accommodations, superb staff and great tapas. Half price happy hour two times every day. John, Jose, Michelle, Theresa & Chelsea, all in the dining room area, were wonderful, friendly and attentive. Aarron, Stephen and Eddie, from the front desk and bell desk, we're very courteous and helpful. This is an all suite hotel with large comfortable rooms, nicely appointed. For military, active or retired, there is a nice discount.",Mozilla,Mobile,1
id10702,"We stayed here for - nights here in June ----.
The staff were extremely friendly and helpful, we arrived too early but they stored our bags for us until we returned later to check in, enabling us to have a walk around the city.
The room itself was comfortable and clean, there were limited choices for breakfast but the food was good quality although there was a lack of seating when busy.
The location is not ideal, it was further from Union Square than I had expected given the description but it is on a direct bus route, and the cable car terminus is just - blocks up.
The excellent Mel's Diner is attached to the hotel, and Tommy's Joynt opposite is a fantastic place to eat and drink.",Google Chrome,Mobile,1
id10703,"Stayed here: - july ---- - - july ----
When entering the hotel there only were two elevator doors, and a A- not pointing out to use the stairs to get to the reception at the -nd floor. Through some nasty hallways, stairways and doors we arrived at the reception. This looked fine. The only employee also had to take the phone which took a lot of her time and made us wait for a very long time to let us know our room wasn't ready yet. 
Returning a few hours later (first watched Live-) we could check in (again we had to wait very long, the receptionist got stressed more and more and got rude to people on the phone). The room had no view, was very small and had tiny beds. It also was very dusty.
The bathroom was clean, but again very clean, you could hardly sit on the toilet...
Checkout took very long again, it will also take a very long time before I will stay here again...
Well, I think it's clear, very small rooms, bad staff, high price. Just go somewhere else.",Firefox,Mobile,0
id10704,"I have stayed a couple of times now in the Loews Regency when I come to NY for business. Unlike other hotels in this price category that Loews offers spacy rooms.
Sleeping experience is first class - very comfortable beds and no noise whatsoever. 
I usually start my day with a run in Central Park and as the Loews is - blocks away from the park, it is in an ideal location. 
Check out and check in is very efficient.",Firefox,Tablet,1
id10705,"I booked this hotel because of the reviews on TripAdvisor.com. They were right! Great hotel and a great stay. The staff was extremely helpful and generous with their time when asked about the local area attractions. The rooms were small, but we were only in the hotel to sleep. It was such a close walking distance to everything. This is the only play I'll stay when visiting Boston. :)",Mozilla,Tablet,1
id10706,"I was a little leery booking this hotel because of the reviews but because we got such a fantastic rate and we wouldn't be spending very much time in the room we took it. I'm glad that we did! The hotel itself is a little dated but I can say that it is very clean and neat. There was always an available elevator and the staff was very friendly and helpful and we were always greeted with a smile!
I would definitely stay here again because of the staff and because of the location. We were in the middle of everything!",Internet Explorer,Tablet,1
id10707,"The hotel was clean and the rooms were nicely decorated. The hotel and furniture were in good shape. They also had a little 'shop' downstairs where you could purchase snacks and small frozen meals.
The room service was fast but after the gratuity charges and another surchrage the waitress still lingered about for a tip. I didn't like her.
My room was also not cleaned on my second day because I was in my room the two consecutive times the cleaning lady knocked. I told her to come back in an hour. She didn't. But they were very nice aout bringing the beauty products that weren't restocked as a result of the room not being cleaned up to me very quickly.
I found Phoenix quite small and it was about -- minutes to most points of interest. The hotel was fairly central. Less if I knew my way around a bit. If I were to go again I would get a place closer to Tempe where there was actual life on the streets. If you do decide to stay at this hotel make sure to go to the Chinese Cultural Centre enarby to eat and check out the amazing grocery store.
The only significant shortcoming of the hotel was it's pool. I expected something nice and large but instead it was a small pool surrrounded by iron gating in the front of the hotel so you were kind of on display to the people parking and checking in. It would be nice if the pool surrounding were a little more lush at least.",Safari,Mobile,1
id10708,"Me and my fiance' decided to get away just before our wedding. Club Quarters offered a reasonable rate at a well situated locale...The good...check in was fast and the, tall, blonde haired guy working behind the desk was accomodating and super efficient...Kudos to him. Unfortunately, everything else was lacking. Rooms were of substandard condition. Due to the age of the building, the walls did not have sound proofing. The doors also were without air compressors so that they would slam when closed. I tried to take a nap about -:-- and all I could hear were kids and adults slamming doors and running around. The room also had a thermostat which would seemed to be non-functional...Me and my fiance froze our butts off even after raising the temp to its highest level. I have seen better bathrooms in -rd world hotels and no tub. My fiance got a workout moving furniture just so that she could find an outlet for her ITouch.
We then decided to go get some pizza at Bucina's(sp?) which we saw in our hotel's restaurant advertisement book. Well, I asked for directions from the girl at the front desk who circled its approximate location. In reality, all she had to say was that it was at the Club Quarters north location which was clearly on the map. Thanks for having us walk in circles for -- minutes....
At the time of our checkout, we decided to get some breakfast at the English pub next door. Don't even bother. We were hoping to get in and out fast so that we could get to the Field Museum...No such luck.. Waited for -- minutes...no service I finally had to """"""""""""""""""""""""""""""""""""""""""""""""""""""""""""""""tackle"""""""""""""""""""""""""""""""""""""""""""""""""""""""""""""""" one of the waitresses to find out what was going on. The end result was $-.-- for orange juice I never ordered, one slice of toast with the food, the orders were wrong, and stiffed when I paid the bill because the manager said there was no change? I actually went into the hotel to tell the front desk what happened and the girl who was looking gave me a beautiful smile and a blank stare. Unfortunately, there were few restaurants open on Sunday near the hotel otherwise I would have ran for the hills. In the case of the hotel, I ran for the exit.",Google Chrome,Desktop,0
id10709,"Ok first impression as you get off the exit is...um...not sure if we wanna stay here. The neighborhood not the best, all the hotels in the area are behind steal fencing. However, once you get in the hotel, it has a great and warm feeling to it. The front desk staff was outstanding, made us feel so welcome. The room itself was as typical and standard as a Hampton, will all the expected amenities. The rate was about what we expected, so can't complain there. The breakfast in my opinion was a step above the typical breakfast. We had omelets and waffles and turkey sausage, fruits, muffins, bagels etc. The breakfast hostess was very helpful answering questions about the area. The housekeepers came out and greeted all of us before they started work. You could tell they were having fun and enjoying their job. We left with a smile on our face, and if we are back in Memphis, we'll stay here again. Location was close to the airport for us, not to far from downtown, shopping, foods etc...and didn't have to pay the price to stay over on Poplar.
Great job! Keep it up!!",Internet Explorer,Mobile,1
id10710,"Above average digs and perfect location for the convention center. Big plus was the ION water filter system at the health club for drinking water, and the adequate pool in the basement where I watched the Celtics and Pistons after a swim while peddling a stationery bike in a much-too-tight Speedo (as Sam Kinison used to say, thanks for the visual)! Bedding and LCD TV added to the comfortable surroundings. Who cares if one gets a beautiful view of the adjoining parking structure? Any woman, that's who! For guys, forget about it! Lobby was spacious as well as the bar restaurant combo. One could not ask for a better abode for only $-- plus taxes at a three star hotel in the Inner Harbor.",InternetExplorer,Desktop,1
id10711,"I love this hotel. The rooftop pool, the fabulous gym, the amazing Burger Joint. It's in a great location that is just a block from Times Square, but enough out of the way that you don't have to deal with the crowds. The downside is the rooms are in need of renovation. The TV was the very old, tube type and it took a while to """"""""""""""""""""""""""""""""""""""""""""""""""""""""""""""""warm up."""""""""""""""""""""""""""""""""""""""""""""""""""""""""""""""" I think that highlighted the amount of time since a renovation since most hotels have now moved to a flat screen. Overall, I love the hotel and will stay again.",Mozilla,Mobile,1
id10712,"Stay was okay at best. Rooms are super small and can get claustrophobic when trying to escape the rain. Wireless internet was terrible in the rooms, barely could stay connected. Room thermostat didn't work right, would either keep blowing hit air non-stop or would shut off completely so we would be either sweating or freezing. Probably will stay somewhere else next time we visit Seattle...in fact we are. Next time in February we will be at the Hyatt. 
Got a deal on Expedia,$--- including parking. I would refuse to pay anymore than that.",Edge,Mobile,0
id10713,"Very affordable for location and amenities. Within walking distance to Navy Pier. After late night in Chicago, got room service, which was delicious and easy. Use underground parkade across from NBC Tower, is about half the price of the parkade beneathe the Sharaton. Room was clean and comfortable. Would definately stay here again because of the price.",InternetExplorer,Desktop,1
id10714,"I was in Seattle on business this past week, and based on room price I decided to stay at the Doubletree at Seatac instead of where I usually stay, the Hampton Inn directly across the street. (The rate difference was a whopping $-.--). So to save $--night, I ended up paying $---night for parking (valet parking is $---night), and $--.----- hours for internet. I received one $-- coupon for any meal, but even as a Hilton Diamond member, there was no coupon for breakfast each morning. The Doubletree is okay, the restaurant and bar are nice. But unless you have a room in the Tower building with a mountain view, (and you need to be on the -th floor at least), there is absolutely nothing special about this hotel.
I will be back in Seattle next month and will galdly return to the newly remodeled Hampton Inn. The bed is wonderful, the working space is adequate, and the breakfast is complimentary for all. As for internet and parking, no extra charge.",IE,Mobile,0
id10715,"I just came back from a - weekend stay and I must say I haven't seen service this good in a while. The persons on site are darlings all of them. Breakfast is abundant for a fast starter and took me by surprise. Forget the continental style this has all the works. Shuttle from - to -- and -- to --, on the hour. Gym needs work, some equipment needs repair, pool and Spa are fine. I'd recommend this hotel to my friends.",InternetExplorer,Desktop,1
id10716,Very pleasant. I've never stayed in Tribeca before and loved the area. Wonderful restaurants. Room very pleasant as well. Hotel has edgy design.,Firefox,Desktop,1
id10717,"This place was perfect for our trip. rooms were very clean and spacious, free breakfast, great location. everything was within walking distance and if it wasn't, the subway stops were just a couple blocks away. most of the staff was very nice. there were a few front desk people that just acted stuck up but lucky for them dumb people like that won't ruin my vacation. but the others were very helpful in recommendations of restaurants and tours. All in all i would recommend this place.",Google Chrome,Desktop,1
id10718,"We stayed here for - nights in October.
Upon checking in we received choc chip cookies seemingly straight out of the oven (very nice touch :) )
Check in was smooth and simple, we had a great view right over Times Square on the --th floor.
I felt that housekeeping was a bit hit or miss, some days they would replace the bathroom soaps and somedays not (a small thing I know), but I also noticed that i'm pretty sure they didn't sweep the bathroom daily as blowdrying my hair would leave hair on the floor and there it would stay accumulating (just one of my gripes).
Being right in Times Square there was anything you needed close by, but of course paying Times Square prices (great breakfast places on -th Avenue without the Times Square prices).
Overall we enjoyed our stay here, I loved looking out the window over Times Square and being right in the middle of it (I didn't notice any noise either)",Mozilla,Mobile,1
id10719,"The hotel has improved considerably since the renovation. (Ok, it used to be a dump.) Now it is clean, smartly decorated and cool. I had a renovated room with the """"""""""""""""""""""""""""""""""""""""""""""""""""""""""""""""I Love New York"""""""""""""""""""""""""""""""""""""""""""""""""""""""""""""""" promotion, so I got a little bag of goodies. The staff even seems to try harder. I'll be back.",InternetExplorer,Mobile,1
id10720,"We spent - nights in that hotel. 
Positive Aspects: Well located, nice swimming pool, large parking
Negative Aspects: The Mexican lady at the front desk was agressive, not polite, not even answering when we were asking a question. She gave us a room under the standard we had paid for. Each time we were asking something we had an agressive answer (if answer was given) and very dark looking at us. 
I think that people like her shouldn't work in commercial activity if they don't respect a minimum
customers.
The place does not look safe, I wouldn't advise it for families. 
Regards,",Mozilla Firefox,Tablet,0
id10721,Very comfortable accommodations in medium-size room. Hotel staff very courteous. Very clean. Liked ambiance in lobby with complimentary wine and cheese. Continental breakfast included good N.Y. pastries. Coffees and cookies available at all times. Computer and printer in lobby for guest's free use.,Mozilla Firefox,Mobile,1
id10722,"We picked this hotel as a romantic holiday getaway. As soon as you walk in, you can feel the warmth of the fireplace and were greeted by a nice staff. Hotel Valet is --.-- but if you park your car yourself in the lot across the street its --.--. It was a good tip given to us by the bell hop. We used the fitness center which is extremely up to date with all new equipment, tvs attached to each machine. We even paid a visit to Asha Salon which is onsite. The entire hotel was redone so everything is brand new and beautiful. Do not expect the largest spaces in the world, but they did a great job of keeping the decor minimal but modern. The location was extremely close to shopping (state street) and to the Daley center for us to be able to visit the Christkindlmarket and check out the giant christmas tree. We ate dinner at Elate restaurant which is next door to the hotel. You do not have to walk outside of the hotel for it. The menu is not the largest in selection, but what we ordered was very tasty. It was a beautiful stay for my husband and I.",InternetExplorer,Desktop,1
id10723,Right in the heart of Times Square. We couldn't have asked for a better location. The hotel itself is very charming. Very large bright bathroom an added plus. We enjoyed the complimentary wine and appetizers in the evening and especially appreciated the fresh fruit that was available all day long. The location was exceptional because it provided for a stopping off place where we could quickly drop in and change clothes or drop off our packages. The staff was very friendly and helpful. They pointed us in the direction of several great restaurants. Would definitely return there upon our next visit.,InternetExplorer,Mobile,1
id10724,"GReta hotel with fantastic service! PeErfect location for our first time in San Francisco. Close to Union Square and all public transport, attractions and restaurants. Rooms was great - nice and spacious with a separate wardrobe area. Bathrooms could do with some reonvating, but that said everything was in fine working order, just a little dated. Would definately stay there again.",Mozilla,Tablet,1
id10725,"Read good review about this hotel, and choose based on recommendation. Overall enjoyed a short one-day stay although there are something to be improved.
- Check-in: Had some problem with self check-in (designated room are not ready??) 
- Room: Was relatively OK but have some problem. Broken mug and unfinished vanity area. Also, bathroom was too dark. Have to open the door.
- Wireless Internet: Had some problem when log-in first, but finally able to log in. However, the overall speed was really slow..
- Breakfast: Was really nice breakfast. Hope it opens a bit late than -:--AM.",Mozilla Firefox,Desktop,1
id10726,"This is the best of the best when it comes to Marriott. First of all, every person on the staff goes out of their way to make sure your every need is met. I needed meeting space and the next thing I know we were sitting in the Presidential Suite. The location is great and the hotel has its own private street and excellent valet parking.",Mozilla Firefox,Mobile,1
id10727,We spent one night. The hotel is great and fairly new. The breakfast was not as good as I would have liked as their famous cinnamon rolls were absent. If you stay ask for a room on the back of the hotel as the front is noisy from Mayport Rd.,Mozilla,Desktop,1
id10728,"We stayed - nights end of May. We got a very large suite, with a full kitchen, outdoor patio, closet, and a safe. Location was very close to a lot of the action, but the hotel didn't get any street noise which was nice. The free breakfast was good. They have a computer and printer that the guests can use. Free underground parking. My only negative comment would be the room wasn't as clean as it could be, I saw some dust in a few corners. But overall I think this hotel is very good value.",Safari,Desktop,1
id10729,"This hotel is a brilliant boutique hotel in a fantastic location for tourists. - minutes from times square but not in the hustle and bustle. -- minute walk to central park, empire state and rockerfeller! Subway stations very close too as well as good restaurants. The hotel was very clean and the staff all very helpful. Upgraded our room and gave a free bottle of champagne for my birthday. 
Breakfast is help yourself continental but was lovely. Although you should get to breakfast before -am as quite busy after that. 
We will definitely stay again if we are lucky enough to be able to go back! Can't recommend highly enough!",Firefox,Mobile,1
id10730,"We stayed at this Westin as part of the first leg of our honeymoon. The rooms are old and a bit small but it was clean, the staff was friendly and it was in the best location!",Edge,Mobile,1
id10731,We stayed at the Warwick because we wanted to have dinner on top of the space needle - it was a romantic get away! We loved the Warwick - very nice room overlooking the space needle and the sliding door opened so we could get air when we slept. That's important to both of us. Very little noise as we were on the --th floor and we slept very well. Great hotel -- definitely try it!,IE,Desktop,1
id10732,"After making my reservations for this hotel I decided to check the ratings, and I must say, they made me very nervous. Some ratings were good, but I focused on the bad ones.I decided to keep my reservations mainly because of the good reputations I have heard of the hotel. I am so glad I didl. I loved the hotel and my children loved it too! We all agreed it felt like we were on the Titanic ship. It was so beautiful and elegant. The room was a good size and it was very clean, and I'm a clean freak! I can't wait to come back with my husband for a weekend getaway.",InternetExplorer,Tablet,1
id10733,"When it comes to midtown Manhattan there are plenty of options. The Benjamin is trying to stand out as a boutique hotel, but the quality of service does not justify the extra cost. Our room wasn't very clean (lots of dust on the TV and the frames, hair in the bathroom). 
The room was pretty small (even to NY standards) but we had a great balcony with view over midtown and the Waldorf. 
The restaurant, The National, was excellent. The problem was again the service, slow and not very professional.",Mozilla,Tablet,0
id10734,"The Sheraton is definitely located in the heart of it all but I was a bit disappointed in the facility itself. As others have stated on this board, the facility is dated. The pictures on Sheraton's website must have been taken right after the renovation was done. The carpeting was worn and unraveling in parts. We had a gorgeous view of Monument Circle but the room window was fogged up either between the panes or very dirty on the outside. The light fixtures and bath fan were also in need of a good cleaning. My real disappointment was with the rooftop pool. The website portrayed the pool area as very nice and beautiful. In reality, it is nothing more than a concrete hole in a vast concrete roof with a few chairs scattered about.
On the plus side, the woman that waited on me during my stay was one of the nicest, most professional front desk people I have ever encountered.",Edge,Mobile,0
id10735,"We had reserved our room for five days, however we checked out after the first night. Let me first state the good things about this hotel. It has an incredible view of the city and the location can't be beat. These two things were not enough to make us stay in our room which had definitely seen better days. The bed actually sagged in the middle, not terribly, but enough to indicate that it was old and should be replaced. The carpets appeared worn as did everything else. There was a huge cigarette burn mark on the bathroom counter. Hopefully they will renovate when the new tower is finished.",Firefox,Tablet,0
id10736,"We stayed at the Alexis for a couple of reasons--we wanted some place special for my birthday and we liked the location because it's within walking distance of The Brooklyn Restaurant where we had dinner. From start to finish, we enjoyed our whole experience at the Alexis! When we arrived at our room, The Author's Suite, I thought we'd been given the wrong room--I was not expecting such a nice big suite! We had a couple of hours to kill after checking in, so we went down to the Bookstore Bar for a drink and a snack. We sat at an outdoor table on a beautiful summer day, ordered some wonderful ahi tuna and crab cakes and a glass of wine, and relaxed while doing some people watchng. The next day we went to the Library Bistro, a cozy spot for breakfast. I will definitely choose the Alexis again when we visit Seattle!",Mozilla Firefox,Tablet,1
id10737,"Nice Location, - mile from Airport. good value if you just wanna stay overnight for a Early Morning Flight. They have a free Shuttle that runs every half hour to Airport. You can also park in the lot for $-.-- a day. Ruby Tuesday is the only place near for a bite to eat, within Walking distance.",Firefox,Tablet,0
id10738,"Not much to add here: Great hotel with cool amenities.
Rooms tend to be small, but you've got everything you need: Comfy bed... TV if needed... FREE (!) wifi that's actually fast for a hotel (-Mbps down)... free purified chilled water near all elevators... automated check-in-check-out... business center with dedicated boarding pass printing... EXCELLENT location... 
Shares a property with Club Quarters. Not sure how that works out, since it's one building, but no complaints here.",Firefox,Mobile,1
id10739,The bed was extremely uncomfortable - hard as a rock. Intresting they try to promote the sale of their bed linens like some other chains. I had a junior suite but it was as cheaply furnished and decorated as a ----'s motel. Poor and general lack of lighting. $-.-- morning cup of coffee at a serve yourself bar by a money anticipated type. The location is excellent but hotel quality and comfort really lacked. Have done much better in Chicago for the same money and location.,Edge,Desktop,0
id10740,"I enjoyed my stay. The staff were very friendly at this hotel. Breakfast was delicious as well. I went back a second time, and had another great stay!",Mozilla,Tablet,1
