User_ID,Description,Browser_Used,Device_Used,Positive
id10432,"I was pleasantly upgraded to a Lake view room, which is always nice.
The room was comfortable, but here's a disclaimer. Because of the funky W styling, there are a set of shutters in a window that seperates the bathroom from the sleeping area. If you're traveling with a companion, this would not allow for much privacy, but if you're traveling alone it enables you to see the view of the lake while you're literally standing in your shower. 
The lobby bar area is fun, but seemed to close rather early.",Firefox,Tablet,1
id10433,"I regret staying here. This is our first night of four and unfortunately we cannot change hotels. First off, I'd called about parking and was told the rate was $--, I specifically asked if that were per day or for then entire stay and the hotel said the entire stay, you pay once (I called hotel directly). Not so. So right off the bat another fee adding to an overpriced room. Our room is a double suite and very small. The electrical outlets are jammed, the lights turn on and off consistently. The hotel staff said, that happens. Our TV would not work, and internet access? No luck there either. Icing on the cake as I write this at -:-- am listening to the same beat of loud middle eastern belly dancing music from the restaurant below our room. I am wide awake and online to see what time the restaurant will close and this madness will stop.",Edge,Tablet,0
id10434,"We're traveling with a group on an escorted bus trip and the hotel was selected by the tour operator, so I can't comment on price or value for money. The room we had was on the top floor overlooking the parks, so we didn't have any problem with street noise. As others have commented, the rooms are a bit tired, but the huge king size bed was comfy and everything was clean. Our tour guide must have let the hotel know that it was my birthday and there was a lovey card and bowl of fruit in the room when we arrived. The hotel was pretty busy as it must be a popular stop for bus tours; the staff were pleasant, but obviously rushed. Prices in the on site restaurant looked okay. It was an easy walk for us to everything we were interested in - Willis Tower, start of Route --, Buckingham Fountain, but we dont mind walking.",Firefox,Desktop,0
id10435,"We were in Chicago for a wedding with friends. We booked the last part of our trip through ----hotels.com. We arrived at the Affinia in late morning of the --th of July, ----. We were shocked to learn our rooms had been cancelled by ----hotels.com. We had already prepaid for the rooms. Yikes! When the staff learned of our trouble they went above and beyond to help us find a solution to the problem.They even tried to find us a different hotel close to the area we wanted to be in. We ended up staying at the Affinia in one giant room with two king beds. The room was above our expectations. We did cut our vacation short because of the snafu but it had nothing to do with the treatment we received at the Affinia. 
The management of the Affinia should be proud of the staff we encountered during our stay at their place of business. We we would recommend this hotel and it's staff to anyone. 
Our Best to the Staff of the Affinia
SMKindall",Edge,Mobile,1
id10436,"The hotel is pleasant, but a little dated, and the bed was the most uncomfortable ever. It's time for a renovation, guys!",Edge,Mobile,0
id10437,"My family recently stayed at the Sportsmen in Studio City. It has an amazing swimming pool, great food, very nice staff. The front desk was very nice and accomodating..even checked us in before our check-in time. Room was very nice, little out dated but reasonable priced. The bathroom was very small and the room had very thin walls. 
Overall, I enjoyed my stay (stayed for -- days). Would stay again.",Google Chrome,Mobile,1
id10438,"The room was very clean and kept that way throughout my stay. Staff was incredibly friendly and responsive, and I felt like a VIP even though I had a special rate for a conference. I still got a paper, for instance, even though my rate was --% off. Normally deeply discounted fares or Priceliners are given a little less goodness. Free laundry for guests, also. And everyone was a concierge. . .if they didn't know how to get to the restaurant or attraction you wanted, they would find the person who knew momentarily.
Perfect, perfect, staff.
ONLY NEGATIVEs:
-. Rooms are a bit small for this price range, but very clean and nice, and the location of this hotel is amazing, but you pay for it.
-. One night, Sunday, I went to the pool (around -pm local time) and the skimmer-pump was turned off, so the water was stagnant and kinda cloudy. I don't know if it was just bad timing, but it was a big turnoff. Otherwise the facilities are very clean. If the pool is open til midnight (which is generous), keep the pump on, please.
Overall excellent experience, but with --% in taxes on top of your room rate, you can easily spend three hundred a night and I don't know if location and magical service is worth that.",Chrome,Tablet,1
id10439,"I stayed here one night on a business trip. Got a great rate compared to the downtown hotels. This is the only hotel that is at the entrance to the airport, so if you want an airport hotel, this is it. It is also right in the middle of the marina with boats and beautiful views in every direction. 
Check in was quick because it was late night. Got upgraded as a SPG member even though I was paying a very low rate. The room was bigger than average because of the curvature of the room. Exceptionally clean with --"""""""""""""""""""""""""""""""""""""""""""""""""""""""""""""""" flat tv and nicely decorated. King bed was big and comfortable. I only heard one plane before I dozed off, but the room is sound proofed well. 
The lobby is bigger then most hotels downtown. It has a great social-computer center with free Internet and computer use. There are two restaurants and two different bars, and a full service Starbucks. Although the prices for food in the bar were high, I think they are on par with most - star hotels. While the menu had some high priced items, there were many items in the $----- range. 
Although parking is $--, this is the same if not less than what many - star hotels charge downtown. I have paid as much as $--. 
Since there are dozens of hotel choices in the downtown area, this hotel only makes sense for me if I don't need to get around the city. Although only - miles from the heart of downtown, it is on a peninsula and a little detached from anything other than the marina and airport. On the other hand, it's location provides great views, particularly at sunrise and sunset while viewing the big city in the background.",Mozilla,Desktop,1
id10440,"As a life long fan of the New Yorker and the famous Round table legend, I checked in for a long weekend -------- worried that after a recent renovation the Algonquin couldn't possibly live up to expectations. But it surpassed them- I loved this hotel and as much as l like to try new places, it will be hard to pry me away from here on future visits. Deliciously old fashioned in the best ways imaginable. Great, polite, accomodating service without the snooty attitude common at so many other famous places; small and intimate ambience- the doormen will remember you! ; understated and classy lobby and bar; great location. Despite recent renovation still feels like Dorothy Parker would be at home here. 
Yes the rooms and baths are small, but the beds are as comfortable as any ritzy resort and, after all, its New York. You aren't going to stay in your hotel room all day anyway are you?
If you like modern, soulless box hotels or snotty must-be-seen places- go elsewhere. But if you want to feel a part of the living history of New York, count yourself lucky if you get to stay here-its the best!",IE,Desktop,1
id10441,Enjoyed our stay at the Thompson LES. Loved the neighborhood! only complaint is that we could not cool down the room. It was near -- almost the entire time. Complained once and they sent someone right up. They said because it was still cool outside that the hotels ac unit wont kick on until it hits a certain temperature. Well I guess it never hit that temperature because we set the room at the lowest temperature and it never cooled down.,Google Chrome,Desktop,1
id10442,"The room was very nice, modern and clean. The location can't be faulted. The staff were exceptionally friendly and helpful, without being intrusive. The roof top bar is just as awesome as it looks in the photos, and the barman there knows what he is doing when it comes to cocktails.
The hotel restaurant was one of the few places in the US where I have found what I (as a Brit) consider to be a decent breakfast.
A couple of little niggles - there's no out of hours rooms service at all, and also no way to make tea or coffee in your room. If there's no room service, they should at least give you a kettle.
Overall though, a really nice hotel and I would happily stay there again",InternetExplorer,Mobile,1
id10443,"Even though Travelodge Space Needle is inexpensive, I wouldn't stay here again. Serious noise problem due to the fact that it is in close proximity to city fire station. In the three nights I stayed here, the sirens went off - times in the middle of the night. Also lots of outdoor noise from outdoors late at night. Also, hotel is remote - you have to walk for blocks to get to a restaurant, and it is a three block walk to the monorail, which is the main method of getting downtown. Lack of cleanliness was apparent -- carpet was filthy - big stains. Front desk staff were not particularly helpful.",Google Chrome,Desktop,0
id10444,"My husband and I went to a business conference and stayed here. I travel for my job about --% of the time and stay in hotels all the time. I would have to say that they have some of the best customer service I have ever seen, and I am picky. I think the extras do add up, like the valet and the food-bar is very expensive. The rooms are very clean with modern furnishings, but the building is really old and seems dated. Overall I would say that it is comfortable just ugly on the inside. Yes there is a train station nearby and you can hear it from the rooms, it did not bother me.",Safari,Desktop,0
id10445,"My boyfriend and friends went to celebrate my --th B-day in San Francisco it was difficult finding a Hotel that would accommodate -- people. Being that is was my first time going I didn’t know were and what hotel to choose from I came across The Opal, it had reasonable prices online and was able to book with them over the phone with “Nick” very nice and informative. I had remembered after the fact that I have AAA and called customer service to find out if they give discounts they told me yes I would just show my card when I check in and get the discount. My posse and I got there at -am in the morning as I’m checking in the lady tells me they have no more parking and will have to park a block away, I was annoyed at the fact that if I booked - Jr. suites they should have enough parking to accommodate the cars arriving. I then ask about the AAA discount the lady tells me she can’t override the price only a manager can and he comes in the morning. I was upset and tired that I opted to fix the problem in the morning. We get into our rooms they are not what expected for Jr. Suites small rooms we had to rearrange our sleeping arrangements. The next morning I spoke with a very pleasant rep “Angela” at the front desk I explain the situation of the parking and AAA, she begins by apologizing she tells me how the discount works which is not how I was told over the phone the -nd time; I was unable to get the AAA discount but I did get - days of free parking worth $-- a day and a bottle of wine for my birthday which I was very satisfied with. She also was very helpful in giving us recommendations for restaurants and things to do in the city. I didn’t have any problems after that as a matter of fact the last day of check out was fast and easy “Carlo” checked us out told us how to get to the Golden Gate Bridge. I realized a day later on our drive back that I forgot my dress and my boyfriends dress shirt in the closest. I called right away they have a lost and found rep “Miriam” she was polite and helpful she said they did have it I asked if they would be able to ship it to me with no hesitation she said of course we can do that for you. I now have my belongings and back home with great memories to look back on.",Mozilla,Desktop,1
id10446,"This hotel is what you would generally expect a Homewood Suites to be like. The staff was very friendly from check-in to check-out of my two week stay. Breakfast was usually hot, and there was always enough food out. There is a Manager's Reception each Monday-Thursday night like at all Homewood's, but I did not attend one of those so I can't comment on the quality. The rooms are awesome. I was fortunate enough to be able to book a fireplace suite. They provide you one firelog for free, but any remaining logs you must buy yourself. They do sell them at the front desk, but if you are going to use more than - I would simply buy them from the nearby Target or Walmart for cheaper. The suite was very spacious. The bedroom itself is the size of your common hotel room. The living area have both a semi-comfortable chair, and a not so comfortable at all couch. The kitchens are equipped with a stove top and microwave, but there is no oven which I find to be a negative. At the very least, a convection oven combined with the microwave would be nice. You will not have a problem finding a place to store your luggage as there are plenty of closets and two sets of drawers. My room also had a patio which would be a nice addition for the Summer months. Some very important advice is that there is a railroad track that runs adjacent to this property. If you are a HiltonHonors member, you are given to option to select your room before you arrive. Rooms on the South side of the property and on the East side of the property are ones to stay away from if you are a light sleeper. My room was in the Southeast corner of the property (the absolute worst place) so I could actually feel the floors shake when the trains went by. Luckily I am not a light sleeper. As far as location, it is a short drive to several restaurants and a great shopping mall. Of course, not all business travelers have the luxury of a rental car so it is nice to be able to walk to restaurants. Well, that will not happen if you stay here. However, they do provide a shuttle that will take you anywhere within a - mile radius. I did not use the shuttle, so I can't comment on how convenient it is. Overall, this is definitely an excellent place to stay for the price. If you are familiar with the Homewood Suites brand, this property will not disappoint. Just stay away from the South and East side of the property and you will have nothing to complain about.",Opera,Tablet,1
id10447,"I've stayed here a few times over the years.
Don't expect a full-service hotel. That's not what this is. These are excellent short-term serviced apartments though.
If you need a base in NYC for a few days, or even a couple of weeks, they're clean, safe and well maintained. I've always had a very large room and a small kitchen, which means I've been able to fix my own breakfast before heading out in the morning.
There are ample delis, a Kinkos and Grand Central just around the corner. I've found the staff to be helpful, but not overly outgoing. There's no bar or restaurant - if you're looking for somewhere practical it's a great place to stay.",Edge,Mobile,1
id10448,"Stayed here August -- - -- and we were pleased with the visit. The decorum is definitely fashion over function but in the end we didn't feel comfort had been sacrificed for aesthetics. 
Our room was on the fourth floor overlooking West --th but we didn't experience any noise problems from the street below. The bedroom was typical in size for NYC, enough room for bed, furnishings, and space to maneuver. The bathroom was close to equal in size with the bedroom with a full shower and a wall shelf for toiletries. The bed was firm but comfortable, the closet and drawers provided plenty of storage space, and the lighting could be adjusted from subtle to extremely bright as needed. 
We visited the bar and ordered a cheese plate (rather plain) and drinks (fresh and delicious). The prices were typical for a hotel bar but the service was friendlier and more attentive than most we've visited. The bar is small but open to the street so there was still plenty to see.
While we stayed here we visited MOMA and attended a concert at the Beacon Theater. We had no problems walking from the hotel to the subway or nearby destinations. We did check our luggage at the front desk for a short period and had no trouble retrieving it later.",Safari,Desktop,1
id10449,"I was very worried once my boyfriend told me he had booked the Dream hotel and then read these review. Some are ture the staff can bea bit rude but nothing more than you would expect in New York. 
The room was small but wow how fantastic the bed was. I wanted to try and get it in my suitcase !!! But really if you are going to New York why would you want to spend all your time in your room. This hotel is not great for business people it is a trendy chic boutique hotel in Manhattan.
I would reccommend any brit to use this hotel, just for the location and beds alone.
The shower was lush !!! Just what I needed after walking all day and night.
The room service was brill (brits - all the freebies you can fit into your suitcase) the shampoo soap etc was lush !!! I still have some and it is brill.
The bar in the hotel is so nice... very very dark but very cool...
PLEASE PLEASE DO NOT BE PUT OFF BY THE BAD REVIEWS. This hotel is not the best you will stay in, but for location, and chic it beats the rest.
I only spent a weekend in New York so location was everything, this did the job. - mins from Times Sq, - mins from Central Park.
- Mins from all the shops.
LOVE IT... xx",IE,Desktop,1
id10450,"I recommend the Burnsley to anybody visiting Denver in a heartbeat! The Russian Gulag-chic concrete exterior is unfortunate but don't let that put you off... The Burnsley is in an excellent location only four or so blocks from the state capitol building and all tourist attractions are easily accessible - in addition the hotel offers a free courtesy shuttle within three miles. We got dropped at the Tabour Center and wondered back along --th street and took the day visiting everything there was to see and do. Parking is covered and convenient and the neighbourhood is safe and quiet.
The staff were wonderful, especially Wyatt, who despite seeming to be doing every job under the sun when we were checking in, took time to accomodate our needs and was really smiley and helpful (as were all the staff we met without exception).
The room was lovely; a two room unit on the seventh floor overlooking the downtown area and the mountains. The bedroom was generously sized, the bed huge and comfortable and the a-c nice and chilly! The main living area shared both the view and balcony and was comfortably furnished. The bonus of it's former life as an appartment block is the sheer amount of space you get for your money - lovely to have been able to have really spread out.
I would be the first to admit that it is perhaps a little outdated and worn in places (but certainly not unstylish) in some of it's furnishings but that somehow added to it's comfortable homely charms! 
In summary, if I could live there, I would!",Chrome,Mobile,1
id10451,"My stay was -------- – -------- and I must say that your staff is one of the best I have encountered in my many travels. However I must say that I was disappointed in the hotel as a whole. The location is its biggest asset, but the room itself is not what I expected based on the pictures you have displayed on your website. The room was consistently hot no matter how low I adjusted the thermostat, the bathroom was a little outdated (based on what’s advertised on your website), and the cable TV had a distorted picture even after the Engineer tried to fix it. I had an issue with my billing on my room service and had to call several times to get it resolved (never received a call from front desk, they just slid an additional bill under my door) .I’m not trying to make comparisons, but I could have stayed in the Trump Tower for a couple hundred dollars more based on what I paid to stay at the property. They have a nice property, but to advertise it as a Four Star Hotel is misleading. I would have to compare it to a Springhill Suite or Holiday Inn Express just without a Concierge. This is not an attempt to bash the property, but to merely make one aware of how their website portrays an image that lacks just a bit of what is expected.",Mozilla,Tablet,0
id10452,"I stayed here for a week on business and felt very welcome. The room was large and comfortable, with a plush and elegant feel. I was initially assigned a room directly above the restaurant, but the staff were very responsive to my request to move and arranged to move all my things while I was out the next day so my new, quieter room was ready for when I returned. 
Staff were almost always very pleasant and made me feel very welcome when passing through the small foyer (which does not really lend itself to any gatherings-meetings beyond an initial meet up). Overall, the standard of service was excellent. 
Food at the hotel's Firefly restaurant, and room service, was generally very good, although prices could have been more reasonable. 
The location is only a hundred metres from Du Pont Circle and the surrounding bars, restaurants and shops. It is within an easy walk of Georgetown (about -- mins) and a little longer walk (about -- mins) to the White House, Washington Monument, Smithsonians and memorials.",Firefox,Tablet,1
id10453,"This was such a wonderful surprise for my wife and me. We have stayed in about -- different hotels in Boston over the years, inlcuding places like The Four Seasons. The Eliot is just the best of them all. The rooms feel like you are in a comfortable home. The staff beds over backwards trying to fulfill your every need. It is quiet but in a superb location right on Comm Ave in Boston, within walking distance to everything. I not only couldn't recommend this hotel any more highly but my wife and I will return here from now on with every visit we make to Boston. Nice job and thanks for a great trip.",Firefox,Mobile,1
id10454,We've just came back ftom ny. Rooms are quite comfortable and clean but need a renewal ( at least the bathroom). Wifi is not free (- dollars per hour) and at the reception - lobby there' s a bit of mess due to restructuring works. The aisles are old and 'sad'. It's near time square not at time square.,Firefox,Mobile,0
id10455,My husband and I went to Washington DC for the first time. We are so glad we stayed at the Westin City Center. Everything was a short walk or a quick taxi ride away. The staff were greeting and there for us with whatever we needed. We had a couple of personal special circumstances and they were generous and thoughtful. The hotel was clean and well maintained. The heavenly bed and dark curtains made it luxurious to rest and sleep in a little.Thank you Westin!,InternetExplorer,Desktop,1
id10456,"We went to Detroit for a baseball game ( our team lost to the kitties) the hotel is two blocks from Comerica , which was great . Has a excellent restaurant with a even better bar . Close to the people mover so we could go anywhere in the city with out driving , walking distance from Fox theatre also! Overall the hotel is clean , the staff is friendly and it's in a great location , only down fall was some street noise late at night , sounded like kids racing motorcycles.",Firefox,Desktop,1
id10457,"I would definitely recommend staying at this hotel. I was in town for a conference and found the staff here to be so friendly and hospitable. From the airport shuttle driver, the concierges, the housekeeping staff, front desk staff and restaurant waitresses, they made my stay very comfortable. A special thanks to Shekal and Tanneshia.",InternetExplorer,Tablet,1
id10458,"I had sought out a budget-friendly hotel in San Diego that did not cost an arm and a leg. I had heard that this budget hotel is very Marine-friendly, and they are! They offer a free shuttle to the Marine Corps Recruit Depot as well as a free airport shuttle. A basic continental breakfast is included. The rooms are very clean and the management is wonderful. The desk clerk actually sought out my son (Marine graduate) in the lobby and congratulated him and thanked him for serving our country! This is not a luxury hotel by any means, it is a fairly basic motel, but I found it very convenient. People have commented that the neighborhood is not good....it is one of those areas that few would confuse with Beverly Hills, but it seemed safe enough.",Edge,Desktop,0
id10459,"This is a very large resort that is sprawled out with different suites. We stayed in the Cambelback suites which is closer to the main lobby and water park. There is a resort fee that is tacked on and we were lucky enough that the water park was opened for the New Years weekend so at least felt we got something out of the resort fee. This resort offers golf, bike rentals, a jogging trail, golf and a spa. There are also a handful of pools to choose from if the water park is closed. The rooms and grounds were kept very clean and the staff is extremely friendly. I agree they could update the tv's but that is not really a complaint for me. The beds are extremely comfortable but do not consider the sofa bed a bed! Very uncomfortable.",Firefox,Tablet,1
