User_ID,Description,Browser_Used,Device_Used,Positive
id10571,"There was nothing really wrong with the Grand Hyatt San Antonio but not much was memorable either. Happened to stay at the Hyatt Regency Riverwalk on the same trip and I would choose that Hyatt over this one hands down. If I hadn't compared the two Hyatts back to back, perhaps I would have looked on the Grand more favorably. 
Service at the Grand Hyatt was friendly, provided the staff weren't overwhelmed by crowds. They did automatically offer and accommodate a late checkout, a positive that seems to have become a trend with the chain for loyalty club members. The lobby was generally very busy and loud but not laid out or furnished in a manner to encourage people-watching. The hotel location is great if attending a convention and still pretty good for any other downtown or riverwalk activities with a few blocks of walking. The staff of the main restaurant were too flustered to acknowledge my presence at the time I tried to visit so I gave up and thus can't review the food. 
My room on the --th floor had a nice view but the furniture was a bit worn and about average for a business hotel and below average for a Hyatt though the style fit the Hyatt brand. All I could get was two double beds and no upgrade for loyalty status. One mattress sagged significantly but the two doubles proved helpful when I switched to the other bed for dramatically improved comfort. 
In the end, the Grand paled in comparison to the other Hyatt downtown, other Hyatts I've stayed at and other competitors in town despite a price tag that seems to be higher. There was no reason to flee this hotel but I didn't find much to draw me back to this location either.",Firefox,Mobile,0
id10572,"This was our second time staying at MP. This time we had - dbl bed room on the --th floor. Room was small, but had what we needed. Clean linens, comfy beds, and a safe. Who needs a coffee maker when European Cafe is right down the street on -th. Only unfortunate thing is that the view was --feet from another room, oh well great shades. 
Check in was fine, we got there early and had to leave our luggage in the manned holding room. Usually there was an employee by the elevators so we did feel safe. It is a great (for NYC) value for our time there, I am looking forward when the renovations are done, just hope the prices don't go way up.
The only bad part of our stay came at the end. The doorman was tryiing to get us in """"""""""""""""""""""""""""""""""""""""""""""""""""""""""""""""his"""""""""""""""""""""""""""""""""""""""""""""""""""""""""""""""" taxi and when we headed to the one we preordered he got mad and dropped the """"""""""""""""""""""""""""""""""""""""""""""""""""""""""""""""F"""""""""""""""""""""""""""""""""""""""""""""""""""""""""""""""" bomb, we were - females, usually don't find that with the employees. But at least everything else went fine. We will be back!!!",Internet Explorer,Desktop,1
id10573,"The hotel was definitely the best place I have stayed in NYC. Very good accomodations, registration was very quick, polite staff...This is the place I will stay anytime in the city.",Edge,Desktop,1
id10574,"This hotel offers it all!!! Friendly helpful staff, wonderful assistant manager, clean and quiet rooms, --- feet from Michigan Avenue, --- feet from Garrett's Popcorn! I don't know why anyone would want to stay anywhere else!!!",Firefox,Tablet,1
id10575,"I am presently staying at River Inn about to check out at -- noon June --, ---- so I am writing this review in Real-time. 
Four rooms in the hotel was prebooked for us through Priceline we checked in June --, ---- the hotel was extremely organized with the arrangements, all our rooms we ready and we had room ---, ---, ---, and ---. The room are nice, very spacious with a queen size bed, a sofa bed, a writing table, two chairs and an arm chair. It is also a self catering hotel with fully functioning kitchen. The only thing is that it is quite old but clean. 
The staff are very helpful and polite, it has a bar and restaurant in the lobby and offer valet paring services to guest as we had a rental car with us. A nice hotel with a good location by the metro. We took a stroll up --th street and found a nice Thai restaurant were we had lunch and a night took a walk back from a night club less than - minutes walk from the hotel. 
Nice location and good place to stay if you are in DC. 
PS no swimming pool or spa but can't remove the ratings on that.",Edge,Tablet,1
id10576,"Over Memorial weekend, we stayed at the Washington Marriott Wardman Park. Overall the hotel was fairly clean, recently updated and was extremely easy to get to. The location is right next to the Wooley Park metro station. The room was recently renovated, and upon first glance the hotel room looked very clean. However upon further inspection, I noticed stray hairs in the bathtub and under the sink. I was disappointed when I opened a cabinet door that looked like it would contain a refrigerator and there was just a giant cabinet. The room did have a -- inch flat screen TV…definitely not HD. Although, the Marriott website advertises that all rooms have HBO, this channel did not come through on our TV. 
My biggest surprise was how many families were staying at the hotel (maybe due to the proximity to the zoo). I would highly recommend that the Marriott put families and business travelers on different floors, as families tend to be noisier and be awake at different hours than business travelers. A screaming child in the hallway disturbed our slumber at a ridiculously early hour two days in a row. 
At then end of the trip, I would say there was nothing to big to complain about and nothing so great to write home about.",Edge,Tablet,0
id10577,"Three of us came to Denver and ended up staying here when the lease on our apartment fell through. After a -- hour drive and a broken down budget rental van, we just wanted a shower and a comfortable bed. We were traveling with a dog and a cat. They took the animals with no problem and no extra fees. We ended up having to extend it from one night to - and that was absolutely no more than a call to the front office. Unfortunately when we tried to e-tend to te - and -th days, they had no rooms available. 
They were romdeling the first and second floors but we heard no noises during the night. They are a little hard to find considering they have no sign on the main road. They are directly behind the panera bread. They have a small parking lot and it filed up during the night. 
The room was very comfortable with a pullout sofa bed in a seperate room from the king size bedroom. The closet was large, as was the counter top next to the sink. The shower curtain is so short that it kept flipping out of the tub when I was taking my shower. I ended up folding the bathroom. They don't have a towel rack near the sink which I thought was odd. They had a hot tub that was open but we didn't have our suits. They have a managers reception for free beer and wine on Mon through Thurs night. The location here is really good. There are a few decent places right outsi de the door to eat. The only thing that could have made it better would be a Walgreens next door.",Edge,Tablet,1
id10578,"Spent one night here before going on cruise on Friday, Sept --th. I was excited to try The W, as it always seemed very intriguing. It was just okay... The location was convenient, as it was near to Pike Street, but the guest service was nothing to talk about. Just fake, plastic smiles that seem quite robotic. No help with my I-phone cell phone charger, as I forgot it home. When I asked, the response I received was just, """"""""""""""""""""""""""""""""""""""""""""""""""""""""""""""""no, can't help you"""""""""""""""""""""""""""""""""""""""""""""""""""""""""""""""". No suggestions or alternative options. Not very hospitality like. The room was okay for one night, nothing great. A """"""""""""""""""""""""""""""""""""""""""""""""""""""""""""""""service charge"""""""""""""""""""""""""""""""""""""""""""""""""""""""""""""""" or more like, """"""""""""""""""""""""""""""""""""""""""""""""""""""""""""""""staff gratuity"""""""""""""""""""""""""""""""""""""""""""""""""""""""""""""""" was automatically included on the bill. Staff is already receiving a gratuity and therefore does not need to go the extra mile or exceed any type of expectations, as they are receiving this extra money automatically. Not a great concept as staff members do not need to provide real customer service.",Edge,Mobile,0
id10579,"This hotel is certainly above average, but I don't find it particularly exciting. The room was usual and clean. Service was not as great as I hoped with front desk staff giving the incorrect hours of room service and when I ordered room service delivery on the electronic system they have for that it never came, no one ever called to inform me that in fact the service closed an hour before the front desk staff had informed me. I had the same problem with the restaurant and they would not seat us for breakfast, (and I had purchased breakfast with the room) because they were going to be closing in -- minutes. While I thought that would be enough time to eat some breakfast, apparently they were unwilling to prepare it with only -- minutes to go before it closed. The lobby is not set up in a way as to be an enjoyable place to stay or people watch and the library room there while lovely to look at has a mold problem. Being highly allergic to mold myself I had to try a couple of rooms and take the allergy free room as the whole lobby, restaurant, library and rooms do seem to have a mold problem. This is unfortunate.",Google Chrome,Mobile,1
id10580,"I stayed here while sightseeing with a group of friends for a weekend. We chose it primarily because it was the most affordable option for us. Although less expensive than other hotels, it was perfectly clean, modern, and comfortable. The location was great for us as well and we were able to walk everywhere from the hotel.",Edge,Mobile,1
id10581,"Reservations for - queens, non smoking at the Hawthorne Suites ---- IH S-- in Austin Texas. Arrived at check-in time at -:--PM and was told that they did not have the kind of room I ordered. All that was available was a double bed with a pull out sofa. When I asked what the point of making and confirming reservations I was told """"""""""""""""""""""""""""""""""""""""""""""""""""""""""""""""sorry, all we do is guarantee a room, not what you ordered"""""""""""""""""""""""""""""""""""""""""""""""""""""""""""""""". The lobby looked dirty and smelled like mildew so I was glad to leave. Would never return there. Did stay at the SpringHill Suites close by which was very pleasant, courteous staff and clean rooms.",Edge,Tablet,0
id10582,"My wife and I stayed here for two nights as the first leg of a long vacation weekend. We arrived earlier than check-in time, but Jo Anne at the desk quickly checked us in to an available room, which really set the tone for a number of positive interactions we had with the staff, whom I can't praise enough. Overall they are one of the friendliest, most positive groups I have encountered, which was especially refreshing for a larger, city-based hotel. Our room was clean and comfortable. There are at least a half-dozen good restaurants within - blocks of the hotel. Beale St. is about - blocks south, and the trolly line is --- block from the hotel's front door. My only complaint was that the free breakfast was a little disorganized - it seemed like every guest in the hotel was there at once.",InternetExplorer,Desktop,1
id10583,"Just a quick note about hospitality at the Westin Times Square.
Our stay could not have been nicer. The staff at the Westin Times Square is the most professional and courteous that I have encountered in a very long time. We stayed in the Atrium Rooms and were very impressed by the room. Spacious enough for - adults and - teens with room to spare. Modern and comfortable. 
The two gentlemen that took care of us daily in The Atrium Lounge went far above the usual service level. 
The Hotel is right in the middle of everyting and very close to subway stops. A Great hotel for a Great City.",Edge,Desktop,1
id10584,"Although the hotel is beautiful, comfy is in a great location, I'm giving a rating of - based on service. I had encountered a few issues that really made me mad. I never received my wake up calls. Also, the fire alarm on my floor was triggered. My floor volunteerily evacuated (at -:-- am) most guests were in the shower or were woken from a deep sleep. After exiting the building, we made our way to the front door where the doorman graciously let us in....neither he nor the front desk had any idea that the alarm was going off. This is truely a saftely issue! We did not receive any appologies or even any type of gesture to make up for this major inconvenice. They had mixed my room reservation up with someone else and I recieved a call on my cell phone because I did not check out. I explained that I was booked until a certain date....They did not want to look into it, instead they offered to pack my stuff up for me. My corporate HQ took care of the issue, however, I still never recieved an appology for the way I was treated....besides that, there were several B and C list """"""""""""""""""""""""""""""""""""""""""""""""""""""""""""""""stars"""""""""""""""""""""""""""""""""""""""""""""""""""""""""""""""" which makes for some interesting people watching. The hotel itself is very clean and the beds are comfy. There was a bit of a funky smell in my room. The decor is ultra swanky....I would not stay here again because of the horrible service I recieved....",Firefox,Tablet,0
id10585,"Our three days stay became a week when we realised how convenient this hotel is. They have incredibly delicious donuts at reception in the morning and are keeping the hotel clean and friendly. The location is very handy to buses, restaurants and walks, you are half an hour from everythings and Russian Hills is a safe upmarket part of San Franscico. From the roof access you can even see the bridge and take picures of it in the sunset. Lombard street is part of highway --, so yes it is busy, but the noise never bothered us, as we did not spend a lot of time in our room and were too tired at night from all the walking to notice it. I would highly recommand this hotel for a family on a budget. One tip, goggle discount tickets as some are available for this hotel.",Opera,Desktop,1
id10586,"i was heading out from the hotel and had to stops some friends to come up and see the size of the room. Barely enough space for the king bed and the bathroom had no place to put your toiletries. the location is great but the rooms....well.. and staff majority have an attitude, why i dont know theyre not curing cancer theyre working in a hotel like thousands and thousands of fine people",Firefox,Desktop,0
id10587,"Grand dame is the only word. If you are traveling to use your Hiltons Honors.....there is a separate check in desk near the escalators. I got a had written thank you note from the HH desk in the evening under my door. Nice touch.
Business center and fitness club use is not complimentary. Hotel is going under a major refit...so one restaurant. The food was very good with better service.
My room was on the smallish side but clean and quiet. They placed me in an area that they deemed for the female solo travelers. Chicago has some petty crime in the loop and I appreciated this attention.
Will return. Place my luggage with the Bell Captain and walked one block to the Art Institute for one hour.
Elegant hotel with Old World Service.",Firefox,Desktop,1
id10588,"I stayed for - nights in July. I had originally booked another hotel further up, but it was getting progressively worse reviews on Trip Advisor, so I decided to change to the Chancellor. On arrival I was immediately glad for the switch. It was a short walk up Powell from the BART station, so a very quick and affordable direct trip from the airport. The hotel staff were friendly, helpful and efficient. The hotel itself had a charming and welcoming atmosphere. I felt very safe and comfortable here which is important as a solo female traveller. The room was lovely, decorated tastefully, had a jar of sweets and a very comfortable bed! Brilliant location with easy access to shopping on Union Square, dining options and transport. SF is a great walking city even with all the hills and I enjoyed a big loop walk down Sutter, Market to Embarcadero and then onto Fisherman's Wharf and back the same way. Another day I took the easy way to Fisherman's Wharf via the cable car you catch on Powell. Would definitely come back to the Chancellor - excellent location, service and facilities and I felt great value for money.",Chrome,Mobile,1
id10589,"what a wonderful - room suite i had. clean and comfortable. spacious, and inviting. accommodated - us with room for more. the front desk staff were friendly, and always ready to help with a smile. perfect place to stay when attending airforce basic graduation. close to everything you need. beautiful pool area as well. continental breakfast was way more than expected. will definitely stay again when i go back to san antonio, and recommend my friends.",Google Chrome,Desktop,1
id10590,"We really enjoyed our stay at City Suites. The location is wonderful. the staff very helpful, and the shops and restaurants within walking distance. Loved the European feel of this boutique hotel. Teenage girls with me and they loved it too. Very eclectic, hip, energy in this part of town.Went to a concert at House of Blues. Only a -- min ride on the red line. Took Amtrak into Chicago, cheaper than driving and parking. -- ride on the Brown line to the hotel from Union Station.",Internet Explorer,Mobile,1
id10591,"I chose this hotel based on location for a theatre week-end. When booking, I requested an early check in and a king bed. Neither were available when I checked in and the hotel had not communicated this to me. When I checked in a few hours later, I was given keys that didn't work. I went back to the reception desk and was given a second set of keys that didn't work. I had to go back down to reception and they changed me to another room where the keys finally worked. On Sat. the hotel boiler broke and there was no hot water all day. Nothing like a cold shower in the morning! The clerk at the reception desk said that the manager would be adjusting my bill due to the inconvenience. This didn't happen. The room was nicely decorated and clean, but extremely small, even for NYC standards. There was no place in the room to put suitcases. I didn't feel that Hotel Mela was a good value and didn't appreciate all of the inconveniences I experienced. I won't stay here again.",Edge,Desktop,0
id10592,"So of course, this hotel looks great in pictures, but in actuality, it is completely opposite. According to the price (the price is high), this Hotel is a rip off. Granted the location is not bad, and is close to my business conference, but the rooms are in terrible condition. The bathroom is gross!!! It looks like a -- year old bathroom with cracks everywhere, and a very small tub-shower. The jacuzzi was dirty and seemed like it wasn't cleaned for months. The hotel staff was not very helpful when I asked for directions and told them about the condition of their rooms. They pretty much didn't care.
I read the reviews and thought for a while if whether I should believe the good ones or the bad ones, but I regret believing the good ones. I should've gone with the few reviews below me that spoke the truth about this hotel. I would've saved a lot of money if I just stayed at a nearby hotel I searched (which was much nicer and cheaper). 
Overall, not a great experience, and definitely wouldn't recommend it to anyone!",Firefox,Desktop,0
id10593,"Stayed - nights at The Orchard and we were very pleased. Great location - blocks from Union Square, with lots of dining and shopping options close by.
Cable car is right outside on Powell St, which was a really nice way to get to fisherman's wharf. 
Get a transportation passport which gives you access to buses, cable cars, trains, etc., good value for getting around the city ... trust me when I say that the hills can be very steep for walking after a long day of sightseeing. 
Price was good value for a downtown hotel and we found the room to be a good size and very clean. Beds & linens were very comfortable. 
We stayed in room --- and the housekeeping was excellent, room was made while we were out for breakfast and turned down while at dinner. 
Doormen and front desk staff always greeted us when we came in or went out. Elevators were quick. 
We really enjoyed our stay at The Orchard and wouldn't hesitate to stay here again the next time we are in San Francisco.",InternetExplorer,Mobile,1
id10594,I was very happy with my stay at this hotel. It was very clean and beds were comfortable. It was pretty nice. I think it's a good value for the price. Only complaint is the room had a little odor but we got used to it I guess. We stayed in a suite Room ---. Overall nice stay. I would stay here again. Stayed at the Adolphus a week later and liked this place much better!,Firefox,Desktop,1
id10595,"Travelled from UK and arrived at Holiday Inn about -.-- in the evening. Check-in was fairly quick but desk staff were rather abrupt. The room itself was clean and tidy however as the room was located near the junction of two roads and two sets of traffic lights the lack of soundproofing was apparent when we entered the room, we believed however that the traffic noise may ease as the evening drew on - WRONG...My family and I were not able to get any sleep due to the constant road noise which rather than getting better later as we had anticipated just got worse - we could hear car radios as they sat at the junction amongst other general traffic noise and road cleaning etc. Quite clearly the soundproofing to the room is inadequate and not the sort of night anyone who has travelled the distance we had wants on their first night in the US.
The next morning my husband complained about the noise and the receptionist said she could move us to another room. We moved to the other room in the morning and then went out as we had travel plans for that day. Upon returning to the room we could hear noise once again - can you believe it we had been put over what I can only imagine was the air conditioning generator or similar, there was a constant noise all night long....how glad were we that we did not have to spend another night here.
Whilst the hotel was clean and tidy and the rooms were adequate we felt very upset that we had been treated so badly. After complaining about the noise on the first night we thought that the staff would have tried at least to give us a room with no noise or even an upgrade but no they did the complete opposite and put us back in the same position.
I would not recommend this hotel for the above reasons and whilst the location to Fishermans Wharf is handy a good nights sleep is more preferable I am sure to anyone. I would love to hear the managements comments as to why they thought it was acceptable to treat us this way. Do not book if you want sleep!",Mozilla,Desktop,0
id10596,"I have stayed at other Four Points Sheratons with great pleasure. But this one was just disgusting. Nobody attending the front desk... crowded kibby with people watching TV... the bellman was rude, the hallways and rooms were under repair or rennovation... many people trying to switch rooms because theirs, as ours, were horrible. And the manager just said: Sorry, there's nothing I can do. Our room (reserved quite in advance) was in the last corner of the hotel, with a view of the parking lot, small, smelly, with no toiletries. Oh well, I will never stay at another of these htoels in my life. disappointing. I moved to teh Westin.",Firefox,Mobile,0
id10597,"Wow i had so much fun, there was some great staff at the desk. i think the girl's name was Naadie, so genuine,pretty smile, helped me with my printing, suggestions about restaurants and aloyt more. u all should check out this hotel.",Mozilla,Mobile,1
id10598,"We had to go to Dallas on a last minute business trip and after searching for hours to find a pet-friendly hotel, we settled on the LaQuinta. Most hotels in Dallas wanted a $---$--- NON-REFUNDABLE deposit. Not only did they accept all - of my welsh corgis, they didn't require a pet fee or deposit. We were also very impressed with the hotel location, (close to many good restaurants, plus the Galleria), cleanliness and comfort of the King Suite.
The staff was very courteous and friendly, and the breakfast was average: cereal, toast, bagels, juice, waffles, yogurt, coffee, etc.
Only thing negative was the aiplanes. However, I didn't find them too bothersome, and slept very well. We will definately stay here again!",Mozilla Firefox,Tablet,1
